{"format":"librett-registry-public-snapshot","schema_version":1,"registry_id":"089016d5-d5f8-4c5e-b015-dfe0b8a45f85","registry_name":"Synthetic catalogue","authority_generation":null,"exported_at":"2026-10-08T14:47:17Z","publication_policy":{"version":"synthetic-1","purpose":"Synthetic tests only","dataset_terms_url":"https://example.invalid/dataset-terms","media_terms_url":"https://example.invalid/media-terms","distribution_scope":"public-download"},"checkpoint":"4","players":[{"id":"3eb37ab0-4547-4059-beca-ec86dad391d5","slug":"3eb37ab0-4547-4059-beca-ec86dad391d5","display_name":"Roundtrip player","revision":"1"},{"id":"cd55b9d1-8109-497c-84dc-ce8457326123","slug":"cd55b9d1-8109-497c-84dc-ce8457326123","display_name":"Roundtrip player","birth_year":1990,"revision":"1"}],"clubs":[{"id":"48384138-639a-4893-98eb-8e8c6ca8fca2","slug":"48384138-639a-4893-98eb-8e8c6ca8fca2","name":"Roundtrip club","revision":"1"}],"memberships":[{"player_id":"3eb37ab0-4547-4059-beca-ec86dad391d5","club_id":"48384138-639a-4893-98eb-8e8c6ca8fca2"},{"player_id":"cd55b9d1-8109-497c-84dc-ce8457326123","club_id":"48384138-639a-4893-98eb-8e8c6ca8fca2"}],"media":[],"tombstones":[]}