{
  "format": "librett-registry-public-snapshot",
  "schema_version": 1,
  "registry_id": "11111111-1111-4111-8111-111111111111",
  "registry_name": "Synthetic example registry",
  "authority_generation": null,
  "checkpoint": "0",
  "exported_at": "2026-10-07T12:00:00Z",
  "publication_policy": {
    "version": "example-1",
    "purpose": "Synthetic documentation example only",
    "dataset_terms_url": "https://example.invalid/dataset-terms",
    "media_terms_url": "https://example.invalid/media-terms",
    "distribution_scope": "public-download"
  },
  "players": [],
  "clubs": [],
  "memberships": [],
  "media": [],
  "tombstones": []
}
