{
  "format": "librett-registry-public-snapshot",
  "schema_version": 1,
  "registry_id": "11111111-1111-4111-8111-111111111111",
  "registry_name": "Synthetic example registry",
  "authority_generation": null,
  "checkpoint": "4",
  "exported_at": "2026-10-07T12:00:00Z",
  "publication_policy": {
    "version": "example-1",
    "purpose": "Synthetic documentation example only",
    "dataset_terms_url": "https://example.invalid/dataset-terms",
    "media_terms_url": "https://example.invalid/media-terms",
    "distribution_scope": "public-download"
  },
  "players": [
    {
      "id": "22222222-2222-4222-8222-222222222222",
      "revision": "1",
      "slug": "example-player",
      "display_name": "Example Player",
      "birth_year": 1990,
      "photo_id": "55555555-5555-4555-8555-555555555555"
    },
    {
      "id": "33333333-3333-4333-8333-333333333333",
      "revision": "1",
      "slug": "example-player-two",
      "display_name": "Example Player"
    }
  ],
  "clubs": [
    {
      "id": "44444444-4444-4444-8444-444444444444",
      "revision": "1",
      "slug": "example-club",
      "name": "Example Club",
      "aliases": [
        "Example TT"
      ]
    }
  ],
  "memberships": [
    {
      "player_id": "22222222-2222-4222-8222-222222222222",
      "club_id": "44444444-4444-4444-8444-444444444444"
    }
  ],
  "media": [
    {
      "id": "55555555-5555-4555-8555-555555555555",
      "revision": "1",
      "content_sha256": "0000000000000000000000000000000000000000000000000000000000000000",
      "mime_type": "image/png",
      "byte_length": 100,
      "width": 10,
      "height": 10,
      "content_url": "https://example.invalid/photo.png",
      "attribution": "Synthetic descriptor; no downloadable image"
    }
  ],
  "tombstones": []
}
